{
  "slug": "la-vida-de-mi-guerra",
  "type": "work",
  "title": "La vida de mi guerra",
  "authorship": null,
  "direction": null,
  "companies": [
    "flamenco-triana"
  ],
  "credits": [],
  "disciplines": [
    "danza"
  ],
  "audience": null,
  "duration_min": null,
  "premiere_year": null,
  "synopsis_md": null,
  "communes": [
    "vina-del-mar"
  ],
  "video_url": null,
  "dossier_url": null,
  "venues": [],
  "history_text": [],
  "media": [],
  "tags": [],
  "sources": [
    {
      "url": "https://www.munivina.cl/noticias/teatro-municipal-de-vina-del-mar-inicia-el-2026-con-espectaculares-conciertos-teatro-danza-y-humor/",
      "title": "Teatro Municipal de Viña del Mar inicia el 2026 con espectaculares conciertos, teatro, danza y humor",
      "publisher": "Ilustre Municipalidad de Viña del Mar",
      "type": "institucional",
      "level": 1,
      "role": "primaria",
      "accessed_at": "2026-09-08",
      "archived_url": null,
      "supports": [],
      "notes": "Nota del 9 de enero de 2026."
    }
  ],
  "verification": {
    "status": "pendiente",
    "confidence_score": 35,
    "verified_at": null,
    "verified_by": null,
    "next_review_at": null,
    "note": "Importado del catastro regional del ecosistema teatral (Fase 1: descubrimiento); pendiente de verificación editorial."
  },
  "published": false
}
