{
  "slug": "fusis",
  "type": "work",
  "title": "FUSIS",
  "authorship": null,
  "direction": null,
  "companies": [],
  "credits": [],
  "disciplines": [
    "danza"
  ],
  "audience": null,
  "duration_min": null,
  "premiere_year": null,
  "synopsis_md": null,
  "communes": [
    "valparaiso"
  ],
  "video_url": null,
  "dossier_url": null,
  "venues": [],
  "history_text": [],
  "media": [],
  "tags": [],
  "sources": [
    {
      "url": "https://www.cultura.gob.cl/eventos-actividades/mes-del-teatro-se-conmemorara-con-nuevos-estrenos-teatro-familiar-y-obras-inclusivas/",
      "title": "Mes del Teatro se conmemorará con nuevos estrenos, teatro familiar y obras inclusivas",
      "publisher": "Ministerio de las Culturas, las Artes y el Patrimonio",
      "type": "institucional",
      "level": 1,
      "role": "primaria",
      "accessed_at": "2026-09-08",
      "archived_url": null,
      "supports": [],
      "notes": "Nota del 10 de mayo de 2022 con la programación regional del Mes del Teatro (11 al 28 de mayo de 2022)."
    }
  ],
  "verification": {
    "status": "pendiente",
    "confidence_score": 35,
    "verified_at": null,
    "verified_by": null,
    "next_review_at": null,
    "note": "Importado del catastro regional del ecosistema teatral (Fase 1: descubrimiento); pendiente de verificación editorial."
  },
  "published": false
}
