{
  "slug": "el-viaje-de-los-caracoles",
  "type": "work",
  "title": "El Viaje de los Caracoles",
  "authorship": null,
  "direction": null,
  "companies": [
    "teatro-anima"
  ],
  "credits": [],
  "disciplines": [
    "teatro"
  ],
  "audience": null,
  "duration_min": null,
  "premiere_year": null,
  "synopsis_md": null,
  "communes": [
    "quillota"
  ],
  "video_url": null,
  "dossier_url": null,
  "venues": [],
  "history_text": [],
  "media": [],
  "tags": [],
  "sources": [
    {
      "url": "https://chilecultura.gob.cl/events/3197/",
      "title": "Ciclo de Teatro Familiar de Quillota",
      "publisher": "Chile Cultura — Ministerio de las Culturas, las Artes y el Patrimonio",
      "type": "institucional",
      "level": 1,
      "role": "primaria",
      "accessed_at": "2026-09-08",
      "archived_url": null,
      "supports": [],
      "notes": "Ficha de evento de 2019: cuatro obras en tres días (18, 19 y 20 de julio de 2019), $2.000, Centro Cultural Leopoldo Silva Reynoard, Avenida 21 de Mayo 200, Quillota. La ficha no asigna cada obra a un día."
    }
  ],
  "verification": {
    "status": "pendiente",
    "confidence_score": 35,
    "verified_at": null,
    "verified_by": null,
    "next_review_at": null,
    "note": "Importado del catastro regional del ecosistema teatral (Fase 1: descubrimiento); pendiente de verificación editorial."
  },
  "published": false
}
