{
  "slug": "anku",
  "type": "work",
  "title": "Anku",
  "authorship": null,
  "direction": null,
  "companies": [
    "teatro-ilucion"
  ],
  "credits": [],
  "disciplines": [
    "teatro"
  ],
  "audience": null,
  "duration_min": null,
  "premiere_year": null,
  "synopsis_md": null,
  "communes": [
    "valparaiso"
  ],
  "video_url": null,
  "dossier_url": null,
  "venues": [],
  "history_text": [],
  "media": [],
  "tags": [],
  "sources": [
    {
      "url": "https://centex.cultura.gob.cl/con-ocho-montajes-en-ocho-espacios-distintos-valparaiso-celebra-mes-del-teatro/",
      "title": "Ciudad Teatro: con ocho montajes en ocho espacios distintos Valparaíso celebra el Mes del Teatro",
      "publisher": "Centex — Centro de Extensión del Ministerio de las Culturas, las Artes y el Patrimonio",
      "type": "institucional",
      "level": 1,
      "role": "primaria",
      "accessed_at": "2026-09-08",
      "archived_url": null,
      "supports": [],
      "notes": "Nota de 2025 con programa completo: 8 funciones entre el 5 y el 11 de mayo de 2025 en Valparaíso. Gratuidad no especificada."
    },
    {
      "url": "https://valpocultura.cl/eventos/categoria/teatro/",
      "title": "Eventos › Teatro — Valpocultura",
      "publisher": "Valpocultura",
      "type": "directorio",
      "level": 3,
      "role": "secundaria",
      "accessed_at": "2026-09-08",
      "archived_url": null,
      "supports": [],
      "notes": "Agenda cultural agregadora; consultada en septiembre de 2026 (35 eventos, la mayoría entradas de la cartelera de la Sala Negra UV)."
    }
  ],
  "verification": {
    "status": "pendiente",
    "confidence_score": 35,
    "verified_at": null,
    "verified_by": null,
    "next_review_at": null,
    "note": "Importado del catastro regional del ecosistema teatral (Fase 1: descubrimiento); pendiente de verificación editorial."
  },
  "published": false
}
