{
  "slug": "variete-de-marionetas-musicales",
  "type": "work",
  "title": "Varieté de Marionetas Musicales",
  "authorship": null,
  "direction": null,
  "companies": [
    "the-magic-show"
  ],
  "credits": [
    {
      "artist": "hugo-hernandez-urtubia",
      "name": "Hugo Hernández Urtubia",
      "role": "creación y manipulación"
    }
  ],
  "disciplines": [
    "titeres",
    "teatro-familiar"
  ],
  "audience": "familiar",
  "duration_min": null,
  "premiere_year": null,
  "synopsis_md": null,
  "communes": [
    "los-andes"
  ],
  "video_url": null,
  "dossier_url": null,
  "venues": [],
  "history_text": [
    "Agosto de 2026: función para estudiantes de la Escuela Mateo Cokljat de San Felipe (Día Nacional del Titiritero y la Titiritera)"
  ],
  "media": [],
  "tags": [],
  "sources": [
    {
      "url": null,
      "title": "Investigación madre Quinta Escena Podcast — perfil 1 (cita Diario El Trabajo)",
      "publisher": "Proyecto Quinta Escena Podcast, folio 863000",
      "type": "documento-proyecto",
      "level": 2,
      "role": "secundaria",
      "accessed_at": "2026-09-05",
      "archived_url": null,
      "supports": [
        "existence",
        "history"
      ],
      "notes": "Diario El Trabajo ya localizado y registrado como fuente propia (ver fuente siguiente)."
    },
    {
      "url": "https://eltrabajo.cl/web/el-arte-de-dar-vida-dos-titiriteros-del-valle-son-reconocidos-como-cultores/",
      "title": "El arte de dar vida: Dos titiriteros del valle son reconocidos como cultores",
      "publisher": "Diario El Trabajo",
      "type": "prensa",
      "level": 2,
      "role": "primaria",
      "accessed_at": "2026-09-05",
      "archived_url": null,
      "supports": [
        "existence",
        "history"
      ],
      "notes": "Confirma la función del 25 de agosto de 2026 en la Escuela Mateo Cokljat de San Felipe (Día Nacional del Titiritero y la Titiritera)."
    },
    {
      "url": null,
      "title": "Carta de compromiso — Los Andes.pdf (31 de agosto de 2026)",
      "publisher": "Proyecto Quinta Escena Podcast, folio 863000",
      "type": "documento-proyecto",
      "level": 3,
      "role": "primaria",
      "accessed_at": "2026-09-05",
      "archived_url": null,
      "supports": [],
      "notes": "Documento interno del proyecto Quinta Escena Podcast; no verificable públicamente."
    },
    {
      "url": null,
      "title": "Investigación madre Quinta Escena Podcast — perfil 1 (cita SIGPA, Diario El Trabajo)",
      "publisher": "Proyecto Quinta Escena Podcast, folio 863000",
      "type": "documento-proyecto",
      "level": 3,
      "role": "secundaria",
      "accessed_at": "2026-09-05",
      "archived_url": null,
      "supports": [],
      "notes": "Documento interno del proyecto Quinta Escena Podcast; no verificable públicamente. Diario El Trabajo ya localizado y registrado como fuente propia (ver fuente siguiente)."
    }
  ],
  "verification": {
    "status": "pendiente",
    "confidence_score": 62,
    "verified_at": null,
    "verified_by": null,
    "next_review_at": null,
    "note": "Existencia y una función confirmadas con fuente pública. Sigue sin fuente nivel 1 propia de la obra (director, año de estreno, sinopsis); confirmar título exacto y ficha con la compañía."
  },
  "published": false
}
